{
  "schemaVersion": 1,
  "executionId": "44444444-4444-4444-8444-444444444444",
  "taskId": "11111111-1111-4111-8111-111111111111",
  "workspaceId": "22222222-2222-4222-8222-222222222222",
  "adapterKind": "openai_sandbox",
  "adapterVersion": "2026-10",
  "executableSha256": null,
  "runtimeKind": "remote_sandbox",
  "runtimeProvider": "openai",
  "startedAt": "2026-10-16T10:15:00Z",
  "finishedAt": null,
  "status": "prepared",
  "taskScopeDigest": "aaaaaaaaaaaaaaaaaaaaaaaaaaaaaaaaaaaaaaaaaaaaaaaaaaaaaaaaaaaaaaaa",
  "enabledTaskTools": [],
  "isolationProfile": "remote_bundle_isolated",
  "promptSha256": "bbbbbbbbbbbbbbbbbbbbbbbbbbbbbbbbbbbbbbbbbbbbbbbbbbbbbbbbbbbbbbbb",
  "outputFileCount": 0,
  "outputTotalBytes": 0,
  "outputAggregateSha256": null,
  "errorCode": null,
  "providerExecutionId": "run-fixture-1234"
}
